<?xml version="1.0" encoding="UTF-8"?>

<EmulatorInformation xmlns:xsi="http://www.w3.org/2001/XMLSchema-instance" xsi:noNamespaceSchemaLocation="emulator.xsd">


    <Cards>
        <Card Name="Nascom 2" Class="com.codingrodent.emulator.cards.nascom2cpu.Nascom2CPUCard">
            <Properties>
                <Property Name="VideoROM" Value="resources/hexdumpImages/ROM/system/CharacterGraphicsROM.nas"/>
                <Property Name="OperatingSystem" Value="resources/hexdumpImages/ROM/system/nassys1.nas"/>
                <Property Name="VideoRAMAddress" Value="0800"/>
                <Property Name="ScratchpadAddress" Value="0C00"/>
                <Property Name="StartAddress" Value="0000"/>

                <Property Name="BankAEnabled" Value="false"/>

                <Property Name="BankBEnabled" Value="false"/>

                <Property Name="nup" Value="false"/>
            </Properties>
        </Card>

    </Cards>

</EmulatorInformation>

